{
  "currency": "EUR",
  "updated": "2026-09-21",
  "einmalig": [
    {
      "id": "solar-speicher",
      "title": "Solarzellen + Speicher",
      "tagline": "Solarstrom fürs ganze Jahr",
      "description": "Fachgerecht vom Elektriker angeschlossen — drückt die laufende Stromrechnung.",
      "icon": "☀",
      "target": 2000,
      "raised": 250
    }
  ],
  "monatlich": [
    {
      "id": "glasfaser",
      "title": "Schnelleres Internet",
      "tagline": "Glasfaser für den Space",
      "description": "Mehrkosten für den Glasfaser-Anschluss.",
      "icon": "⇅",
      "monthly": 30
    }
  ],
  "pulse": {
    "updated": "2026-09-21",
    "start": "2025-05",
    "levels": [
      3
    ]
  }
}
